{
  "full_name": "Avery Chen",
  "preferred_name": "Avery",
  "job_title": "Product Manager",
  "company": "Northstar Workflow Labs",
  "company_size": "120",
  "industry": "B2B workflow software",
  "years_experience": "9",
  "location": "Portland, OR (Pacific)",
  "primary_work": "I lead a small product team building workflow software for operations teams. My work includes customer discovery, roadmap planning, and partnering with engineering on delivery.",
  "current_projects": "- **Workflow redesign:** simplifying a complex approval flow\n- **Analytics:** improving product adoption reporting\n- **AI assistant pilot:** testing a drafting assistant with a small internal group",
  "biggest_challenge": "Balancing customer requests with a focused roadmap while keeping the team aligned on measurable outcomes.",
  "goals_6mo": "Ship the redesigned approval flow and establish a repeatable customer-feedback process",
  "goals_2yr": "Grow into a product leadership role while building a durable, low-complexity product operating system",
  "tech_stack": "TypeScript, React, Node.js, PostgreSQL, Python",
  "ai_tools": "ChatGPT, GitHub Copilot",
  "ai_proficiency": "Intermediate — comfortable using AI for research, drafting, and lightweight coding",
  "ai_pain_points": "Losing project context between sessions and overly confident answers without evidence",
  "favorite_tools": "Linear for issue tracking and VS Code for lightweight code review",
  "tools_avoid": "Tools that require heavy setup for simple workflows",
  "communication_style": "Concise, practical, and explicit about uncertainty",
  "learning_style": "Examples first, then concise reference documentation",
  "work_hours": "Weekdays, Pacific time",
  "hobbies": "Trail running, cooking, and community volunteering",
  "fun_fact": "I keep a tiny vegetable garden and track harvests in a spreadsheet"
}
